{
  "subject": "Re: Traffic Control for Installs",
  "from": {
    "name": "BURKE Jacob T",
    "address": "/o=ExchangeLabs/ou=Exchange Administrative Group (FYDIBOHF23SPDLT)/cn=Recipients/cn=956bef8eab0d44dc8fc1482ce9b06926-7818a864-a8",
    "type": "EX"
  },
  "to": {
    "name": "Matt Triana",
    "address": "matt.triana@flocksafety.com",
    "type": "SMTP"
  },
  "cc": {
    "name": "DEWITT Derek A",
    "address": "/o=ExchangeLabs/ou=Exchange Administrative Group (FYDIBOHF23SPDLT)/cn=Recipients/cn=1f064f8867eb47eaa4104d2690e0ab57-CEPDDAD",
    "type": "EX"
  },
  "bcc": {
    "name": null,
    "address": null,
    "type": null
  },
  "body": "Good morning, \n\nYes, to my knowledge these arrangements have been made.  We will make sure to have traffic control available. \n\n\n\nJake Burke\n\nCaptain � Investigations Division\n\nEugene Police Department\n\n300 Country Club Road\n\nEugene, Oregon 97401\n\n(541) 682-5895 work\n\n \n\n \n\n\n________________________________\n\nFrom: Matt Triana <matt.triana@flocksafety.com>\nSent: Thursday, May 15, 2025 7:53:02 AM\nTo: BURKE Jacob T <JBurke@eugene-or.gov>\nCc: DEWITT Derek A <DDeWitt@eugene-or.gov>\nSubject: Re: Traffic Control for Installs \n \n\n[EXTERNAL ?]\n\nHi Capt,\n\nCamera installations are being checked off. Been a few days since we touched base on traffic control so wanted to check in and make sure Derek was able to connect with the tech to arrange it.\n\nPlease let me know if you have any questions.\n\nRegards\n\t\n \nMatt Triana\nProject Manager\n\n\n\n\t\n https://www.flocksafety.com/articles/1000-missing-persons-reunited?utm_campaign=EmailSignature&utm_source=PMO&utm_medium=Wisestamp \n\n\t\n \t \n <https://tracy.srv.wisestamp.com/px/wsid/QNRBjXxDy31.png> \n\n\nOn Mon, May 12, 2025 at 7:47?AM BURKE Jacob T <JBurke@eugene-or.gov JBurke@eugene-or.gov > wrote:\n\n\n\tMatt, \n\n\t \n\n\tI got your voice mail about coordinating traffic control for some installs that may occur this week.  I also got your cell number of 949-547-3560.  \n\n\t \n\n\tDerek will be back in office this week and can be the point of contact for arranging a marked unit to assist with traffic control.  I was texting with him end of last week.  He anticipates planning to connect with your install techs sometime this week and we briefly talked about the request for assistance for traffic control.  \n\n\t \n\n\tOn a separate note, I reached out to the ODOT regional manager and waiting for a call back to discuss moving forward on the locations controlled by ODOT.  I will advise once I hear back.  \n\n\t \n\n\tThank you \n\n\t \n\n\t \n\n\tJake Burke\n\n\tCaptain � Investigations Division\n\n\tEugene Police Department\n\n\t300 Country Club Road\n\n\tEugene, Oregon 97401\n\n\t(541) 682-5895 work",
  "metadata": {
    "billing_information": null,
    "categories": null,
    "importance": "Normal",
    "mileage": null,
    "sensitivity": "Normal"
  },
  "analysis": {
    "length": 2002,
    "has_signature": false,
    "has_quoted_reply": true,
    "thread_count": 1
  },
  "thread_messages": [
    {
      "from": null,
      "sent": null,
      "to": null,
      "cc": null,
      "subject": null,
      "body": "Good morning, \n\nYes, to my knowledge these arrangements have been made.  We will make sure to have traffic control available. \n\n\n\nJake Burke\n\nCaptain � Investigations Division\n\nEugene Police Department\n\n300 Country Club Road\n\nEugene, Oregon 97401\n\n(541) 682-5895 work\n\n \n\n \n\n\n________________________________"
    },
    {
      "from": "Matt Triana <matt.triana@flocksafety.com>",
      "sent": "Thursday, May 15, 2025 7:53:02 AM",
      "to": "BURKE Jacob T <JBurke@eugene-or.gov>",
      "cc": "DEWITT Derek A <DDeWitt@eugene-or.gov>",
      "subject": "Re: Traffic Control for Installs",
      "body": "[EXTERNAL ?]\n\nHi Capt,\n\nCamera installations are being checked off. Been a few days since we touched base on traffic control so wanted to check in and make sure Derek was able to connect with the tech to arrange it.\n\nPlease let me know if you have any questions.\n\nRegards\n\t\n \nMatt Triana\nProject Manager\n\n\n\n\t\n https://www.flocksafety.com/articles/1000-missing-persons-reunited?utm_campaign=EmailSignature&utm_source=PMO&utm_medium=Wisestamp \n\n\t\n \t \n <https://tracy.srv.wisestamp.com/px/wsid/QNRBjXxDy31.png> \n\n\nOn Mon, May 12, 2025 at 7:47?AM BURKE Jacob T <JBurke@eugene-or.gov JBurke@eugene-or.gov > wrote:\n\n\n\tMatt, \n\n\t \n\n\tI got your voice mail about coordinating traffic control for some installs that may occur this week.  I also got your cell number of 949-547-3560.  \n\n\t \n\n\tDerek will be back in office this week and can be the point of contact for arranging a marked unit to assist with traffic control.  I was texting with him end of last week.  He anticipates planning to connect with your install techs sometime this week and we briefly talked about the request for assistance for traffic control.  \n\n\t \n\n\tOn a separate note, I reached out to the ODOT regional manager and waiting for a call back to discuss moving forward on the locations controlled by ODOT.  I will advise once I hear back.  \n\n\t \n\n\tThank you \n\n\t \n\n\t \n\n\tJake Burke\n\n\tCaptain � Investigations Division\n\n\tEugene Police Department\n\n\t300 Country Club Road\n\n\tEugene, Oregon 97401\n\n\t(541) 682-5895 work"
    }
  ]
}