{
  "subject": "RE: Flock Safety | Follow Up",
  "from": {
    "name": "DEWITT Derek A",
    "address": "/O=EXCHANGELABS/OU=EXCHANGE ADMINISTRATIVE GROUP (FYDIBOHF23SPDLT)/CN=RECIPIENTS/CN=1F064F8867EB47EAA4104D2690E0AB57-CEPDDAD",
    "type": "EX"
  },
  "to": {
    "name": "Gaby Mahoney",
    "address": "gaby.mahoney@flocksafety.com",
    "type": "SMTP"
  },
  "cc": {
    "name": null,
    "address": null,
    "type": null
  },
  "bcc": {
    "name": null,
    "address": null,
    "type": null
  },
  "body": "Thanks for checking in.  I am working on getting all the new camera locations approved.  Everything else is going good.  \n\n\nDerek\n\n \n\nDetective D. DeWitt\n\nFinancial Crimes Unit\n\nSpecial Weapons and Tactics Team\n\nBackground Investigations Team\n\nEugene Police Department\n\n300 County Club Road\n\nEugene, OR 97401\n\nWork hours: Tuesday - Friday 7:30 a.m. � 5:30 p.m.\n\nDesk Phone � 541-682-2682\n\nWork Cell � 541-743-6192\n\n \n\n\n\n \n\nFrom: Gaby Mahoney <gaby.mahoney@flocksafety.com> \nSent: Tuesday, June 24, 2025 2:46 PM\nTo: DEWITT Derek A <DDeWitt@eugene-or.gov>\nSubject: Re: Flock Safety | Follow Up\n\n \n\n[EXTERNAL ?]\n\nHello Detective DeWitt,  \n\n \n\nHope you are having a great week! Just left a voicemail on your cell - just wanted to make sure you feel fully comfortable with Raven Alerts now that Oregon Credit Union is set up in your account. Feel free to provide some good times next week to schedule a meeting and I would be happy to send over a calendar invite. \n\n \n\nThanks!\n\n \n\nOn Mon, Jun 23, 2025 at 3:51?PM Gaby Mahoney <gaby.mahoney@flocksafety.com gaby.mahoney@flocksafety.com > wrote:\n\n\tHi @DEWITT Derek A ddewitt@eugene-or.gov  \n\n\t \n\n\tHope all is well. Do you have time next week for a check in call? I want to make sure everything is moving forward and any questions are getting ironed out. \n\n\t \n\n\tThank you \n\n\t \n\n\t-- \n\n\t\nGaby Mahoney\nCustomer Success Manager\n\n\n\n https://www.instagram.com/flocksafety/ \n\n https://www.facebook.com/flocksafety \n\n https://www.youtube.com/c/FlockSafety \n\n <https://gifo.srv.wisestamp.com/s/rfw4/108062/26/trans.png>  flocksafety.com \n\n\t\n https://www.foxbusiness.com/technology/safety-tech-company-launches-tool-help-law-enforcement-fight-human-trafficking?utm_campaign=EmailSignature&utm_source=Success&utm_medium=Wisestamp \n\n\t\n \n\n\t\n \n\n\t <https://tracy.srv.wisestamp.com/px/wsid/32vWpQWwpyXr.png> \n\n\n\n\n \n\n-- \n\n\t\nGaby Mahoney\nCustomer Success Manager\n\n\n\n https://www.instagram.com/flocksafety/ \n\n https://www.facebook.com/flocksafety \n\n https://www.youtube.com/c/FlockSafety \n\n <https://gifo.srv.wisestamp.com/s/rfw4/108062/26/trans.png>  flocksafety.com \n\n\t\n \n\n\t\n https://www.fox5atlanta.com/news/over-6m-stolen-electronics-recovered-massive-georgia-porch-pirate-operation?utm_campaign=EmailSignature&utm_source=Success&utm_medium=Wisestamp \n\n\t\n \n\n <https://tracy.srv.wisestamp.com/px/wsid/zpnzXLAamrJq.png>",
  "metadata": {
    "billing_information": null,
    "categories": null,
    "importance": "Normal",
    "mileage": null,
    "sensitivity": "Normal"
  },
  "analysis": {
    "length": 2344,
    "has_signature": true,
    "has_quoted_reply": true,
    "thread_count": 1
  },
  "thread_messages": [
    {
      "from": null,
      "sent": null,
      "to": null,
      "cc": null,
      "subject": null,
      "body": "Thanks for checking in.  I am working on getting all the new camera locations approved.  Everything else is going good.  \n\n\nDerek\n\n \n\nDetective D. DeWitt\n\nFinancial Crimes Unit\n\nSpecial Weapons and Tactics Team\n\nBackground Investigations Team\n\nEugene Police Department\n\n300 County Club Road\n\nEugene, OR 97401\n\nWork hours: Tuesday - Friday 7:30 a.m. � 5:30 p.m.\n\nDesk Phone � 541-682-2682\n\nWork Cell � 541-743-6192"
    },
    {
      "from": "Gaby Mahoney <gaby.mahoney@flocksafety.com>",
      "sent": "Tuesday, June 24, 2025 2:46 PM",
      "to": "DEWITT Derek A <DDeWitt@eugene-or.gov>",
      "cc": null,
      "subject": "Re: Flock Safety | Follow Up",
      "body": "[EXTERNAL ?]\n\nHello Detective DeWitt,  \n\n \n\nHope you are having a great week! Just left a voicemail on your cell - just wanted to make sure you feel fully comfortable with Raven Alerts now that Oregon Credit Union is set up in your account. Feel free to provide some good times next week to schedule a meeting and I would be happy to send over a calendar invite. \n\n \n\nThanks!\n\n \n\nOn Mon, Jun 23, 2025 at 3:51?PM Gaby Mahoney <gaby.mahoney@flocksafety.com gaby.mahoney@flocksafety.com > wrote:\n\n\tHi @DEWITT Derek A ddewitt@eugene-or.gov  \n\n\t \n\n\tHope all is well. Do you have time next week for a check in call? I want to make sure everything is moving forward and any questions are getting ironed out. \n\n\t \n\n\tThank you \n\n\t \n\n\t-- \n\n\t\nGaby Mahoney\nCustomer Success Manager\n\n\n\n https://www.instagram.com/flocksafety/ \n\n https://www.facebook.com/flocksafety \n\n https://www.youtube.com/c/FlockSafety \n\n <https://gifo.srv.wisestamp.com/s/rfw4/108062/26/trans.png>  flocksafety.com \n\n\t\n https://www.foxbusiness.com/technology/safety-tech-company-launches-tool-help-law-enforcement-fight-human-trafficking?utm_campaign=EmailSignature&utm_source=Success&utm_medium=Wisestamp \n\n\t\n \n\n\t\n \n\n\t <https://tracy.srv.wisestamp.com/px/wsid/32vWpQWwpyXr.png> \n\n\n\n\n \n\n-- \n\n\t\nGaby Mahoney\nCustomer Success Manager\n\n\n\n https://www.instagram.com/flocksafety/ \n\n https://www.facebook.com/flocksafety \n\n https://www.youtube.com/c/FlockSafety \n\n <https://gifo.srv.wisestamp.com/s/rfw4/108062/26/trans.png>  flocksafety.com \n\n\t\n \n\n\t\n https://www.fox5atlanta.com/news/over-6m-stolen-electronics-recovered-massive-georgia-porch-pirate-operation?utm_campaign=EmailSignature&utm_source=Success&utm_medium=Wisestamp \n\n\t\n \n\n <https://tracy.srv.wisestamp.com/px/wsid/zpnzXLAamrJq.png>"
    }
  ]
}